{
  "$schema": "https://json-schema.org/draft/2020-12/schema",
  "title": "RetroHatch app entry",
  "type": "object",
  "additionalProperties": false,
  "required": ["schema", "id", "name", "description", "developer", "source", "license", "category", "artifacts"],
  "properties": {
    "schema": {"const": 1},
    "id": {"$ref": "#/$defs/id"},
    "name": {"type": "string", "minLength": 1},
    "description": {"type": "string", "minLength": 1},
    "developer": {"type": "string", "minLength": 1},
    "website": {"$ref": "#/$defs/https"},
    "source": {"$ref": "#/$defs/https"},
    "license": {"type": "string", "minLength": 1, "description": "SPDX id, or the literal \"unknown\". Unknown license => no artifact may be available."},
    "category": {"enum": ["application", "utility", "launcher", "theme", "port", "other"]},
    "artifacts": {"type": "array", "items": {"$ref": "#/$defs/artifact"}}
  },
  "$defs": {
    "id": {"type": "string", "pattern": "^[a-z0-9][a-z0-9-]{0,63}$"},
    "https": {"type": "string", "pattern": "^https://[^\\s]+$"},
    "sha256": {"type": "string", "pattern": "^[0-9a-f]{64}$"},
    "artifact": {
      "type": "object",
      "additionalProperties": false,
      "required": ["device", "firmware", "format", "status", "compatibility"],
      "properties": {
        "device": {"$ref": "#/$defs/id"},
        "firmware": {"$ref": "#/$defs/id"},
        "format": {"enum": ["opk", "apk"]},
        "status": {"enum": ["available", "unavailable"], "description": "Only \"available\" artifacts can be offered for install."},
        "unavailable_reason": {"type": "string"},
        "version": {"type": "string"},
        "url": {"$ref": "#/$defs/https"},
        "sha256": {"$ref": "#/$defs/sha256"},
        "size": {"type": "integer", "minimum": 1},
        "install": {"type": "object", "additionalProperties": false,
          "properties": {"dest_name": {"type": "string", "pattern": "^[A-Za-z0-9._-]{1,64}$"}}},
        "compatibility": {
          "type": "object", "additionalProperties": false, "required": ["level"],
          "properties": {
            "level": {"enum": ["verified", "community", "experimental", "unsupported", "untested"]},
            "evidence": {"type": "array", "items": {
              "type": "object", "additionalProperties": false, "required": ["sha256", "date", "tester"],
              "properties": {"sha256": {"$ref": "#/$defs/sha256"}, "date": {"type": "string", "pattern": "^\\d{4}-\\d{2}-\\d{2}$"},
                "tester": {"type": "string"}, "note": {"type": "string"}}}}
          }
        }
      }
    }
  }
}
