{
 "schema": 1,
 "id": "fx-app-5",
 "name": "Fixture App 5",
 "description": "Fixture entry 5 used only by the UI tests; not a real app.",
 "developer": "fixture-dev",
 "source": "https://example.invalid/fx/5",
 "license": "MIT",
 "category": "application",
 "artifacts": [
  {
   "device": "rg-nano",
   "firmware": "funkeyos-drum78",
   "format": "opk",
   "status": "available",
   "version": "1.2.3",
   "size": 1468006,
   "compatibility": {
    "level": "verified"
   }
  }
 ]
}